{
  "account_ref": "Account-****1234",
  "base_currency": {
    "candidates": [],
    "note": null,
    "source_refs": [
      "source-synthetic-screenshot"
    ],
    "status": "EXTRACTED",
    "value": "USD"
  },
  "cash": {
    "candidates": [],
    "note": "截图明确显示 Cash Not shown，不能推断为零",
    "source_refs": [],
    "status": "MISSING",
    "value": null
  },
  "draft_hash": "39e6dfa9fcf6e616d7b13b55e3083126768d3b009739bb2a980d89782331d3e8",
  "draft_id": "draft-synthetic-screenshot",
  "portfolio_as_of": {
    "candidates": [],
    "note": null,
    "source_refs": [
      "source-synthetic-screenshot"
    ],
    "status": "EXTRACTED",
    "value": "2026-09-11T20:00:00+08:00"
  },
  "portfolio_complete": true,
  "portfolio_scope": "BROKER_ACCOUNT",
  "positions": [
    {
      "asset_type": {
        "candidates": [],
        "note": "首版输入声明为美股普通股",
        "source_refs": [
          "source-synthetic-screenshot"
        ],
        "status": "EXTRACTED",
        "value": "COMMON_STOCK"
      },
      "cost_basis": {
        "candidates": [],
        "note": null,
        "source_refs": [
          "source-synthetic-screenshot"
        ],
        "status": "EXTRACTED",
        "value": 181.25
      },
      "market": {
        "candidates": [],
        "note": null,
        "source_refs": [
          "source-synthetic-screenshot"
        ],
        "status": "EXTRACTED",
        "value": "US"
      },
      "option_contract": null,
      "position_id": "position-aapl",
      "quantity": {
        "candidates": [],
        "note": null,
        "source_refs": [
          "source-synthetic-screenshot"
        ],
        "status": "EXTRACTED",
        "value": 12
      },
      "ticker": {
        "candidates": [],
        "note": null,
        "source_refs": [
          "source-synthetic-screenshot"
        ],
        "status": "EXTRACTED",
        "value": "AAPL"
      }
    },
    {
      "asset_type": {
        "candidates": [],
        "note": "首版输入声明为美股普通股",
        "source_refs": [
          "source-synthetic-screenshot"
        ],
        "status": "EXTRACTED",
        "value": "COMMON_STOCK"
      },
      "cost_basis": {
        "candidates": [],
        "note": null,
        "source_refs": [
          "source-synthetic-screenshot"
        ],
        "status": "EXTRACTED",
        "value": 392.1
      },
      "market": {
        "candidates": [],
        "note": null,
        "source_refs": [
          "source-synthetic-screenshot"
        ],
        "status": "EXTRACTED",
        "value": "US"
      },
      "option_contract": null,
      "position_id": "position-msft",
      "quantity": {
        "candidates": [],
        "note": null,
        "source_refs": [
          "source-synthetic-screenshot"
        ],
        "status": "EXTRACTED",
        "value": 8
      },
      "ticker": {
        "candidates": [],
        "note": null,
        "source_refs": [
          "source-synthetic-screenshot"
        ],
        "status": "EXTRACTED",
        "value": "MSFT"
      }
    },
    {
      "asset_type": {
        "candidates": [],
        "note": "首版输入声明为美股普通股",
        "source_refs": [
          "source-synthetic-screenshot"
        ],
        "status": "EXTRACTED",
        "value": "COMMON_STOCK"
      },
      "cost_basis": {
        "candidates": [],
        "note": null,
        "source_refs": [
          "source-synthetic-screenshot"
        ],
        "status": "EXTRACTED",
        "value": 118.4
      },
      "market": {
        "candidates": [],
        "note": null,
        "source_refs": [
          "source-synthetic-screenshot"
        ],
        "status": "EXTRACTED",
        "value": "US"
      },
      "option_contract": null,
      "position_id": "position-nvda",
      "quantity": {
        "candidates": [],
        "note": null,
        "source_refs": [
          "source-synthetic-screenshot"
        ],
        "status": "EXTRACTED",
        "value": 20
      },
      "ticker": {
        "candidates": [],
        "note": null,
        "source_refs": [
          "source-synthetic-screenshot"
        ],
        "status": "EXTRACTED",
        "value": "NVDA"
      }
    },
    {
      "asset_type": {
        "candidates": [],
        "note": "首版输入声明为美股普通股",
        "source_refs": [
          "source-synthetic-screenshot"
        ],
        "status": "EXTRACTED",
        "value": "COMMON_STOCK"
      },
      "cost_basis": {
        "candidates": [],
        "note": null,
        "source_refs": [
          "source-synthetic-screenshot"
        ],
        "status": "EXTRACTED",
        "value": 176.8
      },
      "market": {
        "candidates": [],
        "note": null,
        "source_refs": [
          "source-synthetic-screenshot"
        ],
        "status": "EXTRACTED",
        "value": "US"
      },
      "option_contract": null,
      "position_id": "position-amzn",
      "quantity": {
        "candidates": [],
        "note": null,
        "source_refs": [
          "source-synthetic-screenshot"
        ],
        "status": "EXTRACTED",
        "value": 6
      },
      "ticker": {
        "candidates": [],
        "note": null,
        "source_refs": [
          "source-synthetic-screenshot"
        ],
        "status": "EXTRACTED",
        "value": "AMZN"
      }
    },
    {
      "asset_type": {
        "candidates": [],
        "note": "首版输入声明为美股普通股",
        "source_refs": [
          "source-synthetic-screenshot"
        ],
        "status": "EXTRACTED",
        "value": "COMMON_STOCK"
      },
      "cost_basis": {
        "candidates": [],
        "note": null,
        "source_refs": [
          "source-synthetic-screenshot"
        ],
        "status": "EXTRACTED",
        "value": 164.3
      },
      "market": {
        "candidates": [],
        "note": null,
        "source_refs": [
          "source-synthetic-screenshot"
        ],
        "status": "EXTRACTED",
        "value": "US"
      },
      "option_contract": null,
      "position_id": "position-googl",
      "quantity": {
        "candidates": [],
        "note": null,
        "source_refs": [
          "source-synthetic-screenshot"
        ],
        "status": "EXTRACTED",
        "value": 10
      },
      "ticker": {
        "candidates": [],
        "note": null,
        "source_refs": [
          "source-synthetic-screenshot"
        ],
        "status": "EXTRACTED",
        "value": "GOOGL"
      }
    }
  ],
  "schema_version": "portfolio-draft/2.0.0",
  "source_items": [
    {
      "as_of": "2026-09-11T20:00:00+08:00",
      "content_hash": "6b7ae242ac6b778ca90f763caf4018918a638edca006e4fda0261421ef225626",
      "coverage_status": "COMPLETE",
      "external_ref": "evals/fixtures/portfolio-intake/synthetic-account-page.png",
      "retrieved_at": "2026-09-11T20:02:00+08:00",
      "source_id": "source-synthetic-screenshot",
      "source_type": "SCREENSHOT",
      "synthetic": true
    }
  ],
  "unresolved_fields": [
    "cash"
  ],
  "unsupported_assets": []
}
